{
  "manifest_version": "1.0.0",
  "project_type": "2d_topdown_shooter_action_rpg",
  "engine_target": "godot_4.5",
  "status_enum": [
    "not_started",
    "in_progress",
    "blocked",
    "complete",
    "regression_blocked"
  ],
  "artifact_types": [
    "task_packet",
    "plan_note",
    "patch_summary",
    "diff_excerpt",
    "check_report",
    "scene_contract_report",
    "memory_entry",
    "asset_brief",
    "tutorial_note",
    "ui_wireframe",
    "performance_report",
    "release_checklist"
  ],
  "completion_policy": {
    "default_rule": "all_checklist_pass && required_artifacts_present && verify_pass",
    "requires_memory_entry": true,
    "requires_dependency_completion": true
  },
  "sections": [
    {
      "id": "1.0",
      "title": "Foundation & Workflow",
      "level": 1,
      "parent_id": null,
      "status": "not_started",
      "goal": "Establish project structure, AI workflow rules, and dual-pane tracking shell.",
      "dependencies": [],
      "required_artifact_types": [
        "task_packet",
        "check_report",
        "memory_entry"
      ],
      "checklist": [
        {"id": "1.0.c1", "text": "All 1.x subsections complete", "status": "not_started"}
      ],
      "completion_rule": "all_children_complete",
      "completion_message": "ðŸŽ‰ Congratulations on completing section 1.0 Foundation & Workflow!",
      "next_section_id": "2.0"
    },
    {
      "id": "1.1",
      "title": "Create project and folder architecture",
      "level": 2,
      "parent_id": "1.0",
      "status": "not_started",
      "goal": "Create a clean, scalable folder layout and baseline docs.",
      "dependencies": [],
      "required_artifact_types": [
        "task_packet",
        "check_report",
        "memory_entry",
        "tutorial_note"
      ],
      "checklist": [
        {"id": "1.1.c1", "text": "Project created in Godot 4.5", "status": "not_started"},
        {"id": "1.1.c2", "text": "Required folders created", "status": "not_started"},
        {"id": "1.1.c3", "text": "Base docs added (style/api/scene/failure)", "status": "not_started"}
      ],
      "completion_rule": "all_checklist_pass && required_artifacts_present && verify_pass",
      "completion_message": "ðŸŽ‰ Congratulations on completing section 1.1!",
      "next_section_id": "1.2"
    },
    {
      "id": "1.2",
      "title": "Configure InputMap and control standards",
      "level": 2,
      "parent_id": "1.0",
      "status": "not_started",
      "goal": "Define action-based input controls for keyboard/controller.",
      "dependencies": ["1.1"],
      "required_artifact_types": [
        "task_packet",
        "check_report",
        "memory_entry",
        "tutorial_note"
      ],
      "checklist": [
        {"id": "1.2.c1", "text": "Actions added: movement/attack/interact/dash/pause", "status": "not_started"},
        {"id": "1.2.c2", "text": "Default bindings configured", "status": "not_started"},
        {"id": "1.2.c3", "text": "Input contract documented", "status": "not_started"}
      ],
      "completion_rule": "all_checklist_pass && required_artifacts_present && verify_pass",
      "completion_message": "ðŸŽ‰ Congratulations on completing section 1.2!",
      "next_section_id": "1.3"
    },
    {
      "id": "1.3",
      "title": "Initialize AI workflow docs and gate scripts",
      "level": 2,
      "parent_id": "1.0",
      "status": "not_started",
      "goal": "Install task/memory/check gate infrastructure.",
      "dependencies": ["1.2"],
      "required_artifact_types": [
        "task_packet",
        "patch_summary",
        "check_report",
        "memory_entry"
      ],
      "checklist": [
        {"id": "1.3.c1", "text": "Task packet template added", "status": "not_started"},
        {"id": "1.3.c2", "text": "Memory schema and log initialized", "status": "not_started"},
        {"id": "1.3.c3", "text": "Pre-commit/CI gate installed", "status": "not_started"},
        {"id": "1.3.c4", "text": "Gate fails intentionally bad packet and passes valid packet", "status": "not_started"}
      ],
      "completion_rule": "all_checklist_pass && required_artifacts_present && verify_pass",
      "completion_message": "ðŸŽ‰ Congratulations on completing section 1.3!",
      "next_section_id": "1.4"
    },
    {
      "id": "1.4",
      "title": "Configure dual-pane UI shell",
      "level": 2,
      "parent_id": "1.0",
      "status": "not_started",
      "goal": "Build left chat pane and right section/artifact pane.",
      "dependencies": ["1.3"],
      "required_artifact_types": [
        "task_packet",
        "ui_wireframe",
        "check_report",
        "memory_entry"
      ],
      "checklist": [
        {"id": "1.4.c1", "text": "Left pane chat shell renders", "status": "not_started"},
        {"id": "1.4.c2", "text": "Right pane section tree renders", "status": "not_started"},
        {"id": "1.4.c3", "text": "Artifact inspect drawer works", "status": "not_started"},
        {"id": "1.4.c4", "text": "Selecting section scopes chat context", "status": "not_started"}
      ],
      "completion_rule": "all_checklist_pass && required_artifacts_present && verify_pass",
      "completion_message": "ðŸŽ‰ Congratulations on completing section 1.4!",
      "next_section_id": "2.0"
    },
    {
      "id": "2.0",
      "title": "Core Shooter Template",
      "level": 1,
      "parent_id": null,
      "status": "not_started",
      "goal": "Build a playable top-down shooter loop with UI.",
      "dependencies": ["1.0"],
      "required_artifact_types": [
        "check_report",
        "memory_entry"
      ],
      "checklist": [
        {"id": "2.0.c1", "text": "All 2.x subsections complete", "status": "not_started"},
        {"id": "2.0.c2", "text": "One-minute playable loop passes", "status": "not_started"}
      ],
      "completion_rule": "all_children_complete && integration_verify_pass",
      "completion_message": "ðŸŽ‰ Congratulations on completing section 2.0 Core Shooter!",
      "next_section_id": "3.0"
    },
    {
      "id": "2.1",
      "title": "Create Main scene and canonical node tree",
      "level": 2,
      "parent_id": "2.0",
      "status": "not_started",
      "goal": "Establish standard node hierarchy for systems and gameplay.",
      "dependencies": ["1.4"],
      "required_artifact_types": [
        "task_packet",
        "scene_contract_report",
        "check_report",
        "memory_entry"
      ],
      "checklist": [
        {"id": "2.1.c1", "text": "Main scene contains required top-level nodes", "status": "not_started"},
        {"id": "2.1.c2", "text": "Scene contract documentation updated", "status": "not_started"},
        {"id": "2.1.c3", "text": "Scene loads without runtime errors", "status": "not_started"}
      ],
      "completion_rule": "all_checklist_pass && required_artifacts_present && verify_pass",
      "completion_message": "ðŸŽ‰ Congratulations on completing section 2.1!",
      "next_section_id": "2.2"
    },
    {
      "id": "2.2",
      "title": "Implement player movement (8-direction top-down)",
      "level": 2,
      "parent_id": "2.0",
      "status": "not_started",
      "goal": "Implement stable 8-direction movement with proper physics loop.",
      "dependencies": ["2.1", "1.2"],
      "required_artifact_types": [
        "task_packet",
        "patch_summary",
        "check_report",
        "memory_entry",
        "tutorial_note"
      ],
      "checklist": [
        {"id": "2.2.c1", "text": "Player moves in 8 directions", "status": "not_started"},
        {"id": "2.2.c2", "text": "Movement logic runs in _physics_process", "status": "not_started"},
        {"id": "2.2.c3", "text": "No raw keycode usage", "status": "not_started"}
      ],
      "completion_rule": "all_checklist_pass && required_artifacts_present && verify_pass",
      "completion_message": "ðŸŽ‰ Congratulations on completing section 2.2!",
      "next_section_id": "2.3"
    },
    {
      "id": "2.3",
      "title": "Implement camera follow",
      "level": 2,
      "parent_id": "2.0",
      "status": "not_started",
      "goal": "Attach smooth and readable camera behavior.",
      "dependencies": ["2.2"],
      "required_artifact_types": [
        "task_packet",
        "patch_summary",
        "check_report",
        "memory_entry"
      ],
      "checklist": [
        {"id": "2.3.c1", "text": "Camera follows player", "status": "not_started"},
        {"id": "2.3.c2", "text": "No jitter under normal movement", "status": "not_started"}
      ],
      "completion_rule": "all_checklist_pass && required_artifacts_present && verify_pass",
      "completion_message": "ðŸŽ‰ Congratulations on completing section 2.3!",
      "next_section_id": "2.4"
    },
    {
      "id": "2.4",
      "title": "Implement basic shooting",
      "level": 2,
      "parent_id": "2.0",
      "status": "not_started",
      "goal": "Player can fire projectile with cooldown.",
      "dependencies": ["2.2"],
      "required_artifact_types": [
        "task_packet",
        "patch_summary",
        "check_report",
        "memory_entry"
      ],
      "checklist": [
        {"id": "2.4.c1", "text": "Projectile spawns and travels correctly", "status": "not_started"},
        {"id": "2.4.c2", "text": "Cooldown enforced", "status": "not_started"},
        {"id": "2.4.c3", "text": "No null-target crashes", "status": "not_started"}
      ],
      "completion_rule": "all_checklist_pass && required_artifacts_present && verify_pass",
      "completion_message": "ðŸŽ‰ Congratulations on completing section 2.4!",
      "next_section_id": "2.5"
    },
    {
      "id": "2.5",
      "title": "Enemy basic AI + health/death",
      "level": 2,